{
  "profile": "disabled",
  "result": {
    "case": "plain",
    "isolation": {
      "cleanup_verified": true,
      "monitor": "DP-2",
      "no_initial_focus": true,
      "workspace": 8
    },
    "launch_mode": "standalone_process_launch",
    "notes": [],
    "processes": {
      "child_included": true,
      "child_pid": 43761,
      "count_after": 2,
      "count_before": 2,
      "root_pids": [
        43756
      ]
    },
    "resources": {
      "context_switches": 51,
      "cpu_ticks": 1,
      "rss_after_bytes": 52854784,
      "rss_before_bytes": 52731904,
      "rss_growth_bytes": 122880
    },
    "schema": "splinterm.benchmark.graphical-output.v1",
    "terminal": "foot",
    "valid": true,
    "workload": {
      "child_write_duration_ns": 2896219,
      "columns": 80,
      "lines": 5000,
      "payload_bytes": 405000,
      "total_bytes": 405126,
      "trigger_to_visible_marker_ns": 148894567,
      "trigger_to_write_complete_ns": 4943456,
      "visible_boundary": "screenshot_polling_approximation",
      "visible_marker_pixels": 12800
    }
  },
  "schema": "splinterm.benchmark.scrollback.v1",
  "scrollback_lines": 0,
  "terminal": "foot",
  "valid": true
}
