{
  "profile": "disabled",
  "result": {
    "case": "plain",
    "isolation": {
      "cleanup_verified": true,
      "monitor": "DP-2",
      "no_initial_focus": true,
      "workspace": 8
    },
    "launch_mode": "prestarted_daemon_client_launch",
    "notes": [],
    "processes": {
      "child_included": true,
      "child_pid": 44518,
      "count_after": 3,
      "count_before": 3,
      "root_pids": [
        44504,
        44513
      ]
    },
    "resources": {
      "context_switches": 95,
      "cpu_ticks": 16,
      "rss_after_bytes": 58826752,
      "rss_before_bytes": 46366720,
      "rss_growth_bytes": 12460032
    },
    "schema": "splinterm.benchmark.graphical-output.v1",
    "terminal": "splinterm",
    "valid": true,
    "workload": {
      "child_write_duration_ns": 91564273,
      "columns": 80,
      "lines": 5000,
      "payload_bytes": 405000,
      "total_bytes": 405126,
      "trigger_to_visible_marker_ns": 519710682,
      "trigger_to_write_complete_ns": 93188166,
      "visible_boundary": "screenshot_polling_approximation",
      "visible_marker_pixels": 12800
    }
  },
  "schema": "splinterm.benchmark.scrollback.v1",
  "scrollback_lines": 0,
  "terminal": "splinterm",
  "valid": true
}
